[
  {
    "question_id": "xizong-official-2024-n101",
    "system_id": "digestive_metabolic_endocrine",
    "block_id": "D19",
    "primary_kp_id": "digestive-d19-kp25",
    "supporting_kp_ids": [],
    "review_status": "REVIEWED",
    "provenance": {
      "question_truth_path": "content/xizong/questions/shards/2024/q101-125.json",
      "question_truth_blob_sha": "25ae77e1b233e6399ef4dbd5d0ab5b7c10a421c9",
      "knowledge_path": "content/xizong/knowledge/systems/b-digestive-metabolic-endocrine-tumor/d-d1-d23/消化系统_D19_胆汁黄疸胆石胆道感染与肝脓肿_学习阅读版_v1_最终执行版.md",
      "knowledge_blob_sha": "a9e56098ee8fb4f7a2cb067edf63ecb160e37ffd"
    },
    "review": {
      "semantic_owner": "Chat",
      "anti_anchored": true,
      "old_mapping_inherited": false,
      "basis": "Independent SECOND_PASS solve: after ultrasound already shows a large liver abscess, Current D19 KP25 explicitly preserves CT as the next imaging layer for low-density lesion morphology, enhancement and extent."
    }
  },
  {
    "question_id": "xizong-official-2024-n107",
    "system_id": "neuro_sensory_motor_orthopedics",
    "block_id": "orthopedics-o13",
    "primary_kp_id": "orthopedics-o13-kp08",
    "supporting_kp_ids": [],
    "review_status": "REVIEWED",
    "provenance": {
      "question_truth_path": "content/xizong/questions/shards/2024/q101-125.json",
      "question_truth_blob_sha": "25ae77e1b233e6399ef4dbd5d0ab5b7c10a421c9",
      "knowledge_path": "content/xizong/knowledge/systems/d-neuro-sensory-motor-orthopedics/o-o1-o16/骨科系统_O13_化脓性骨与关节感染_学习阅读版_v1_最终执行版.md",
      "knowledge_blob_sha": "5e692e3069a717a60879ef57e69b84517ac8fa16"
    },
    "review": {
      "semantic_owner": "Chat",
      "anti_anchored": true,
      "old_mapping_inherited": false,
      "basis": "Independent SECOND_PASS solve: Current O13 KP08 explicitly retains intra-articular antibiotic injection or continuous irrigation as a Study local-treatment interface for septic arthritis, alongside systemic antibiotics and effective joint-space clearance."
    }
  },
  {
    "question_id": "xizong-official-2024-n120",
    "system_id": "digestive_metabolic_endocrine",
    "block_id": "M4",
    "primary_kp_id": "biochem-m4-kp01",
    "supporting_kp_ids": [],
    "review_status": "REVIEWED",
    "provenance": {
      "question_truth_path": "content/xizong/questions/shards/2024/q101-125.json",
      "question_truth_blob_sha": "25ae77e1b233e6399ef4dbd5d0ab5b7c10a421c9",
      "knowledge_path": "content/xizong/knowledge/systems/b-digestive-metabolic-endocrine-tumor/m-m1-m10/M4_糖原与糖异生_学习阅读版_v1_最终执行版.md",
      "knowledge_blob_sha": "ad0b9c829299f1bb6a8010e6acdf62810e35fa29"
    },
    "review": {
      "semantic_owner": "Chat",
      "anti_anchored": true,
      "old_mapping_inherited": false,
      "basis": "Independent SECOND_PASS solve: Current M4 KP01 explicitly defines G-6-P as a shared metabolic branch point feeding both glycolysis and the pentose-phosphate pathway."
    }
  },
  {
    "question_id": "xizong-official-2024-n121",
    "system_id": "digestive_metabolic_endocrine",
    "block_id": "M4",
    "primary_kp_id": "biochem-m4-kp01",
    "supporting_kp_ids": [
      "biochem-m4-kp02",
      "biochem-m4-kp03"
    ],
    "review_status": "REVIEWED",
    "provenance": {
      "question_truth_path": "content/xizong/questions/shards/2024/q101-125.json",
      "question_truth_blob_sha": "25ae77e1b233e6399ef4dbd5d0ab5b7c10a421c9",
      "knowledge_path": "content/xizong/knowledge/systems/b-digestive-metabolic-endocrine-tumor/m-m1-m10/M4_糖原与糖异生_学习阅读版_v1_最终执行版.md",
      "knowledge_blob_sha": "ad0b9c829299f1bb6a8010e6acdf62810e35fa29"
    },
    "review": {
      "semantic_owner": "Chat",
      "anti_anchored": true,
      "old_mapping_inherited": false,
      "basis": "Independent SECOND_PASS solve: Current M4 KP01 explicitly names G-6-P as the common glycogen synthesis/degradation interface; KP02 and KP03 show the bidirectional G6P↔G1P placement in synthesis and breakdown."
    }
  },
  {
    "question_id": "xizong-official-2024-n124",
    "system_id": "circulation",
    "block_id": "circulation-b04",
    "primary_kp_id": "circulation-b04-kp17",
    "supporting_kp_ids": [
      "circulation-b04-kp18"
    ],
    "review_status": "REVIEWED",
    "provenance": {
      "question_truth_path": "content/xizong/questions/shards/2024/q101-125.json",
      "question_truth_blob_sha": "25ae77e1b233e6399ef4dbd5d0ab5b7c10a421c9",
      "knowledge_path": "content/xizong/knowledge/systems/a1-circulation/blocks/Block4_正常止血与病理循环整合_学习阅读版_v1_Batch2冻结版.md",
      "knowledge_blob_sha": "dc4d9af4cc8cdef413c2b7b3cafd50acff2d92ff"
    },
    "review": {
      "semantic_owner": "Chat",
      "anti_anchored": true,
      "old_mapping_inherited": false,
      "basis": "Independent SECOND_PASS solve: Current B4 KP17 explicitly links prolonged bed rest to DVT, and KP18 owns thrombus→embolus→embolism; a two-week post-fracture event therefore safely maps to thromboembolism while the explanation keeps fat-embolism timing as a boundary."
    }
  },
  {
    "question_id": "xizong-official-2024-n125",
    "system_id": "neuro_sensory_motor_orthopedics",
    "block_id": "orthopedics-o10",
    "primary_kp_id": "orthopedics-o10-kp03",
    "supporting_kp_ids": [],
    "review_status": "REVIEWED",
    "provenance": {
      "question_truth_path": "content/xizong/questions/shards/2024/q101-125.json",
      "question_truth_blob_sha": "25ae77e1b233e6399ef4dbd5d0ab5b7c10a421c9",
      "knowledge_path": "content/xizong/knowledge/systems/d-neuro-sensory-motor-orthopedics/o-o1-o16/骨科系统_O10_股骨头无菌性坏死_学习阅读版_v1_最终执行版.md",
      "knowledge_blob_sha": "fa95024be4ebd3bba5c27e23a17428cff63bb5dc"
    },
    "review": {
      "semantic_owner": "Chat",
      "anti_anchored": true,
      "old_mapping_inherited": false,
      "basis": "Independent SECOND_PASS solve: Current O10 KP03 explicitly preserves decompression/caisson/diver disease as a nitrogen-embolism interface, which directly supports the official answer."
    }
  }
]
