[
  {
    "question_id": "xizong-official-2014-n177",
    "system_id": "digestive-metabolic-endocrine-tumor",
    "block_id": "D5",
    "supporting_kp_ids": [],
    "review_status": "REVIEWED",
    "provenance": {
      "question_truth_path": "content/xizong/questions/shards/2014/q176-200.json",
      "question_truth_blob_sha": "e1ee2386628e1717ceb74437a938ec12a7f5d260",
      "knowledge_path": "content/xizong/knowledge/systems/b-digestive-metabolic-endocrine-tumor/d-d1-d23/D5_能量体温应激与临床营养_学习阅读版_v1_最终执行版.md",
      "knowledge_blob_sha": "5cf336d86aa5d261a5c35b16b54b4c8c19efd01e"
    },
    "review": {
      "semantic_owner": "Chat",
      "basis": "Final unified owner review: Current Block D5 is the smallest safe owner for '长期肠外营养肝胆并发症'. Block-level relation retained rather than guessing a narrower KP.",
      "old_mapping_inherited": false
    }
  },
  {
    "question_id": "xizong-official-2014-n178",
    "system_id": "hematology_immunity_infection",
    "block_id": "hematology-h27",
    "supporting_kp_ids": [],
    "review_status": "REVIEWED",
    "provenance": {
      "question_truth_path": "content/xizong/questions/shards/2014/q176-200.json",
      "question_truth_blob_sha": "e1ee2386628e1717ceb74437a938ec12a7f5d260",
      "knowledge_path": "content/xizong/knowledge/systems/c-hematology-immunity-infection/blocks/血液系统_H27_破伤风与气性坏疽_学习阅读版_v1_最终执行版.md",
      "knowledge_blob_sha": "a6ece581cdd506d2e8d9c8ffab63f90134880abe"
    },
    "review": {
      "semantic_owner": "Chat",
      "basis": "Final unified owner review: Current Block hematology-h27 is the smallest safe owner for '气性坏疽处理'. Block-level relation retained rather than guessing a narrower KP.",
      "old_mapping_inherited": false
    }
  },
  {
    "question_id": "xizong-official-2014-n179",
    "system_id": "neuro_sensory_motor_orthopedics",
    "block_id": "orthopedics-o14",
    "supporting_kp_ids": [],
    "review_status": "REVIEWED",
    "provenance": {
      "question_truth_path": "content/xizong/questions/shards/2014/q176-200.json",
      "question_truth_blob_sha": "e1ee2386628e1717ceb74437a938ec12a7f5d260",
      "knowledge_path": "content/xizong/knowledge/systems/d-neuro-sensory-motor-orthopedics/o-o1-o16/骨科系统_O14_骨与关节结核_学习阅读版_v1_最终执行版.md",
      "knowledge_blob_sha": "820c701b83246d68b83f820ae602c952aff815de"
    },
    "review": {
      "semantic_owner": "Chat",
      "basis": "Final unified owner review: Current Block orthopedics-o14 is the smallest safe owner for '骨关节结核临床特点'. Block-level relation retained rather than guessing a narrower KP.",
      "old_mapping_inherited": false
    }
  },
  {
    "question_id": "xizong-official-2014-n180",
    "system_id": "neuro_sensory_motor_orthopedics",
    "block_id": "orthopedics-o15",
    "supporting_kp_ids": [],
    "review_status": "REVIEWED",
    "provenance": {
      "question_truth_path": "content/xizong/questions/shards/2014/q176-200.json",
      "question_truth_blob_sha": "e1ee2386628e1717ceb74437a938ec12a7f5d260",
      "knowledge_path": "content/xizong/knowledge/systems/d-neuro-sensory-motor-orthopedics/o-o1-o16/骨科系统_O15_OA_AS_RA骨科坐标_学习阅读版_v1_最终执行版.md",
      "knowledge_blob_sha": "ad6209024f40e7ba079b8ba624e6fd7c4cdc9ce1"
    },
    "review": {
      "semantic_owner": "Chat",
      "basis": "Final unified owner review: Current Block orthopedics-o15 is the smallest safe owner for '继发性骨关节炎原因'. Block-level relation retained rather than guessing a narrower KP.",
      "old_mapping_inherited": false
    }
  }
]
